{"accepted_evidence":{"evidence_object_count":0,"manifest_sha256":"e3b0c44298fc1c149afbf4c8996fb92427ae41e4649b934ca495991b7852b855","snapshot_id":"mw-evidence-e3b0c44298fc","snapshot_sha256":"e3b0c44298fc1c149afbf4c8996fb92427ae41e4649b934ca495991b7852b855"},"capture":{"status":"current","version":"1.2.0"},"content":{"release":"0.0.0","status":"empty"},"generated_at":null,"reconciliation":{},"release":{"latest_package_release":"1.2.0"},"source_corpus":{"manifest_sha256":"e3b0c44298fc1c149afbf4c8996fb92427ae41e4649b934ca495991b7852b855","registered_words":0,"snapshot_id":"wiki-corpus-empty","snapshot_sha256":"e3b0c44298fc1c149afbf4c8996fb92427ae41e4649b934ca495991b7852b855","source_material_count":0},"state_schema_version":"2.0.0","system":{"mechanism_version":"1.2.0","schema_version":"1.0.0","status":"operational"},"type":"system-state"}
